{
  "object_type": "TRUTH_FRAME_REGISTRY",
  "schema_version": "1.0.0",
  "current_frame": "tf_000001",
  "frames": [
    {
      "frame_id": "tf_000001",
      "title": "Cross-Venue Prediction Lag",
      "status": "LIVE_PUBLIC_TRUTH_FRAME",
      "truth_frame_path": "cases/tf-000001-cross-venue-prediction-lag/TRUTH_FRAME.json",
      "source_manifest_path": "cases/tf-000001-cross-venue-prediction-lag/SOURCE_MANIFEST.json",
      "replay_manifest_path": "cases/tf-000001-cross-venue-prediction-lag/REPLAY_MANIFEST.json",
      "render_source_path": "apps/terminal/tf-000001.html",
      "live_proof_path": "reports/current/tf-000001-public-surface-live.json",
      "release_ledger_path": "releases/v0.1.0/RELEASE_LEDGER.json",
      "public_url": "https://truthframer.github.io/truthframer-platform/",
      "render_url": "https://truthframer.github.io/truthframer-platform/render/",
      "proof_url": "https://truthframer.github.io/truthframer-platform/proof/PUBLIC_SURFACE_PROOF.json",
      "case_object_url": "https://truthframer.github.io/truthframer-platform/case/tf-000001/TRUTH_FRAME.json",
      "release": "v0.1.0",
      "release_url": "https://github.com/TRUTHFRAMER/truthframer-platform/releases/tag/v0.1.0"
    },
    {
      "frame_id": "tf_000002",
      "title": "Level 3 Order Flow",
      "status": "LIVE_PUBLIC_TRUTH_FRAME",
      "truth_frame_path": "cases/tf-000002-level3-order-flow/TRUTH_FRAME.json",
      "source_manifest_path": "cases/tf-000002-level3-order-flow/SOURCE_MANIFEST.json",
      "replay_manifest_path": "cases/tf-000002-level3-order-flow/REPLAY_MANIFEST.json",
      "render_source_path": "apps/terminal/tf-000002.html",
      "public_url": "https://truthframer.github.io/truthframer-platform/",
      "render_url": "https://truthframer.github.io/truthframer-platform/render/tf-000002/",
      "proof_url": "https://truthframer.github.io/truthframer-platform/proof/tf-000002/PUBLIC_SURFACE_PROOF.json",
      "case_object_url": "https://truthframer.github.io/truthframer-platform/case/tf-000002/TRUTH_FRAME.json",
      "release": null,
      "live_proof_path": "reports/current/tf-000002-public-surface-live.json"
    },
    {
      "frame_id": "tf_000003",
      "title": "FPGA vs CPU Latency Boundary",
      "status": "LIVE_PUBLIC_TRUTH_FRAME",
      "truth_frame_path": "cases/tf-000003-fpga-vs-cpu-latency-boundary/TRUTH_FRAME.json",
      "source_manifest_path": "cases/tf-000003-fpga-vs-cpu-latency-boundary/SOURCE_MANIFEST.json",
      "replay_manifest_path": "cases/tf-000003-fpga-vs-cpu-latency-boundary/REPLAY_MANIFEST.json",
      "render_source_path": "apps/terminal/tf-000003.html",
      "public_url": "https://truthframer.github.io/truthframer-platform/",
      "render_url": "https://truthframer.github.io/truthframer-platform/render/tf-000003/",
      "proof_url": "https://truthframer.github.io/truthframer-platform/proof/tf-000003/PUBLIC_SURFACE_PROOF.json",
      "case_object_url": "https://truthframer.github.io/truthframer-platform/case/tf-000003/TRUTH_FRAME.json",
      "release": null,
      "live_proof_path": "reports/current/tf-000003-public-surface-live.json"
    },
    {
      "frame_id": "tf_000004",
      "title": "Correlation Regime Break",
      "status": "LIVE_PUBLIC_TRUTH_FRAME",
      "truth_frame_path": "cases/tf-000004-correlation-regime-break/TRUTH_FRAME.json",
      "source_manifest_path": "cases/tf-000004-correlation-regime-break/SOURCE_MANIFEST.json",
      "replay_manifest_path": "cases/tf-000004-correlation-regime-break/REPLAY_MANIFEST.json",
      "render_source_path": "apps/terminal/tf-000004.html",
      "public_url": "https://truthframer.github.io/truthframer-platform/",
      "render_url": "https://truthframer.github.io/truthframer-platform/render/tf-000004/",
      "proof_url": "https://truthframer.github.io/truthframer-platform/proof/tf-000004/PUBLIC_SURFACE_PROOF.json",
      "case_object_url": "https://truthframer.github.io/truthframer-platform/case/tf-000004/TRUTH_FRAME.json",
      "release": null,
      "live_proof_path": "reports/current/tf-000004-public-surface-live.json"
    }
  ],
  "boundary": [
    "not investment advice",
    "not trade recommendation",
    "not broker execution",
    "valid only for declared sources and replay window"
  ]
}
